{
  "case_id": "TB-MCP-04",
  "notes": "pollMessages returns session-scoped AICP envelopes with cursor correlation",
  "mcp_request": {
    "jsonrpc": "2.0",
    "id": "tb-mcp-04",
    "method": "tools/call",
    "params": {
      "name": "aicp.pollMessages",
      "arguments": {
        "session_id": "sGT1",
        "after_cursor": "m0",
        "limit": 2
      }
    }
  },
  "mcp_response": {
    "jsonrpc": "2.0",
    "id": "tb-mcp-04",
    "result": {
      "messages": [
        {
          "session_id": "sGT1",
          "message_id": "m1",
          "timestamp": "2026-01-01T00:00:00Z",
          "sender": "agent:A",
          "message_type": "CONTRACT_PROPOSE",
          "contract_id": "cGT1",
          "contract_ref": {
            "branch_id": "main",
            "base_version": "v1",
            "head_version": "v1"
          },
          "payload": {
            "contract": {
              "contract_id": "cGT1",
              "goal": "golden_demo",
              "roles": [
                "initiator",
                "responder"
              ]
            },
            "contract_hash": "sha256:wKY_CpI6-HtaTMTpufl-eTjXYQXv8Igzv7DFBjdDkS4",
            "note": "propose contract v1"
          },
          "message_hash": "sha256:p9cBy1U2rzEkfWkoRQtY_Yd1bx8DFra3az8u3pxtlhw",
          "signatures": [
            {
              "signer": "agent:A",
              "kid": "A1",
              "object_type": "message",
              "object_hash": "sha256:p9cBy1U2rzEkfWkoRQtY_Yd1bx8DFra3az8u3pxtlhw",
              "sig_b64url": "Kc-w_l9sUC3A40zH2LyqFliHdPfbQDZZud9swZ-zLc-WNqCiV1mjGC2moZ48KNR5YQJwU02GlLzCKplqUIccCw"
            }
          ]
        }
      ],
      "next_cursor": "m1"
    }
  }
}
